<?xml version="1.0" encoding="UTF-8"?>
<Config xmlns:xsi="http://www.w3.org/2001/XMLSchema-instance"
        xsi:noNamespaceSchemaLocation="schema/connect-configuration.xsd">
    <General>
        <GeneralItems>
            <ConfigItem key="terminal.name" value="HVR" comment="Name of port"/>
            <ConfigItem key="environment.name" value="TST" comment="N4 installation"/>
            <ConfigItem key="yard.scope" value="YYY/XXX/ZZZ/WWW" comment=""/>
            <ConfigItem key="email.hostname" value="smtp.gmail.com" comment=""/>
            <ConfigItem key="email.smtpport" value="587" comment=""/>
            <ConfigItem key="email.username" value="harrievanrijn@gmail.com" comment=""/>
            <ConfigItem key="email.password" value="aueq vucf nptt tihl" comment=""/>
            <ConfigItem key="email.sender" value="harrievanrijn@gmail.com" comment=""/>
        </GeneralItems>
    </General>
    <Connections>
        <Kafka name="KAFKA">
            <ConfigItem key="hostname" value="localhost" comment="Hostname/IP-address of the kafka broker"/>
            <ConfigItem key="hostport" value="9092,9093,9094"/>
            <ConfigItem key="schema.registry.port" value="8081" comment="The port number of the schema registry"/>
            <ConfigItem key="connection.timeout.ms" value="10000" comment="Max time it may to take to connect"/>
            <ConfigItem key="group.id" value="aicon-tos-mediator" comment="Group id allows multiple consumers to read in parallel"/>
            <ConfigItem key="poll.timeout.ms" value="1000" comment="Time for every poll session of the kafka stream"/>
            <ConfigItem key="cdc.topic.prefix" value="tos.test7" comment="The prefix to every tos-table given by the cdc connector." />
        </Kafka>
        <Http name="HTTP_SEND">
            <ConfigItem key="http.url" value="http://remote_webserver:8080/junit/api" comment="The URL of the HTTP receiver."/>
            <ConfigItem key="http.method" value="POST" comment="The method to use for sending."/>
            <ConfigItem key="http.content.type" value="xml" comment="The content type used for sending."/>
            <ConfigItem key="http.connect.timeout.ms" value="5000" comment="The time it may take for connecting."/>
            <ConfigItem key="http.read.timeout.ms" value="10000" comment="The time it may take for reading (incl.connection time)."/>
        </Http>
        <Http name="HTTP_TEMPLATE">
            <ConfigItem key="http.url" value="http://&lt;IP-address&gt;:&lt;port&gt;/&lt;common-path&gt;/" comment="The URL of the HTTP receiver."/>
            <ConfigItem key="http.method" value="POST" comment="The method to use for sending."/>
            <ConfigItem key="http.content.type" value="xml" comment="The content type used for sending."/>
            <ConfigItem key="http.connect.timeout.ms" value="5000" comment="The time it may take for connecting."/>
            <ConfigItem key="http.read.timeout.ms" value="10000" comment="The time it may take for reading (incl.connection time)."/>
        </Http>
        <Http name="TOS-N4">
            <ConfigItem key="http.url" value="http://localhost:8282/aico-tos-connect/basicXMLWebService" comment="The URL of the HTTP receiver." />
            <!--
            <ConfigItem key="http.url" value="http://n4-webservice-node:9081/argo/basicXMLWebService" comment="The URL of the HTTP receiver." />
            -->
            <ConfigItem key="http.method" value="POST" comment="The method to use for sending." />
            <ConfigItem key="http.content.type" value="xml" comment="The content type used for sending."/>
            <ConfigItem key="http.connect.timeout.ms" value="5000" comment="The time it may take for connecting." />
            <ConfigItem key="http.read.timeout.ms" value="10000" comment="The time it may take for reading (incl.connection time)." />
            <ConfigItem key="transformer.class" value="com.aicon.tos.connect.http.transformers.SoapTransformer"
                                                                        comment="Transformer class to wrap the request and strip the response."/>
        </Http>
    </Connections>
    <Flows>
        <Flow name="FLOW_1">
            <ConfigItem key="url.path" value="" comment="Extends the path of the connection URL"/>
            <ConfigItem key="topic.source" value="" comment="The source topic to subscribe to"/>
            <ConfigItem key="topic.response.ok" value="" comment="The response topic to send to when a response has been received"/>
            <ConfigItem key="topic.response.fail" value="" comment="The response topic to send to when connection failed (when empty, the ok respone top[ic will be used."/>
            <ConfigItem key="transformer.request" value="" comment="The transformer full classname (available on the classpath) to transform the request into a message the TOS accepts."/>
            <ConfigItem key="transformer.response" value="" comment="The transformer full classname (available on the classpath) to transform the response into a message Avlino accepts."/>
            <HttpRef ref="HTTP_SEND"/>
            <KafkaRef ref="KAFKA"/>
        </Flow>
        <Flow name="FLOW_2">
            <ConfigItem key="url.path" value="" comment="Extends the path of the connection URL"/>
            <ConfigItem key="topic.source" value="" comment="The source topic to subscribe to"/>
            <ConfigItem key="topic.response.ok" value="" comment="The response topic to send to when a response has been received"/>
            <ConfigItem key="topic.response.fail" value="" comment="The response topic to send to when connection failed (when empty, the ok respone top[ic will be used."/>
            <ConfigItem key="transformer.request" value="" comment="The transformer full classname (available on the classpath) to transform the request into a message the TOS accepts."/>
            <ConfigItem key="transformer.response" value="" comment="The transformer full classname (available on the classpath) to transform the response into a message Avlino accepts."/>
            <HttpRef ref="HTTP_SEND"/>
            <KafkaRef ref="KAFKA"/>
        </Flow>
        <Flow name="ControlFlow">
            <ConfigItem key="topic.source" value="AICON_TOS_CONTROL" comment="The source topic to subscribe to"/>
            <ConfigItem key="topic.response.ok" value="AICON_TOS_CONTROL_MESSAGE"
                        comment="The response topic to send to when a response has been received"/>
            <ConfigItem key="topic.response.fail" value=""
                        comment="The response topic to send to when connection failed (when empty, the ok response topic will be used."/>
            <ConfigItem key="transformer.request" value=""
                        comment="The transformer full classname (available on the classpath) to transform the request into a message the TOS accepts."/>
            <ConfigItem key="transformer.response" value=""
                        comment="The transformer full classname (available on the classpath) to transform the response into a message Avlino accepts."/>
            <HttpRef ref="TOS-N4"/>
            <KafkaRef ref="KAFKA"/>
        </Flow>
    </Flows>
    <TosControl>
        <CanaryCheck name="Canary Check">
            <ConfigItem key="canary.on.off" value="off"/>
            <ConfigItem key="canary.interval.ms" value="12000"/>
            <ConfigItem key="canary.cdc.frequency" value="6"/>
            <CDCTable name="inv_move_event">
                <ConfigItem key="topic.name" value="INV_MOVE_EVENT_MV"/>
                <ConfigItem key="cdc.threshold" value="50000"/>
            </CDCTable>
            <CDCTable name="inv_unit_fcy_visit">
                <ConfigItem key="topic.name" value="INV_UNIT_FCY_VISIT_MV"/>
                <ConfigItem key="cdc.threshold" value="50000"/>
            </CDCTable>
            <CDCTable name="inv_wi">
                <ConfigItem key="topic.name" value="INV_WI_MV"/>
                <ConfigItem key="cdc.threshold" value="50000"/>
            </CDCTable>
            <HttpRef ref="TOS-N4"/>
            <KafkaRef ref="KAFKA"/>
        </CanaryCheck>
        <ControlRequest name="Control Request">
            <ConfigItem key="topic.source" value="aicon_tos_control" comment="tobefilled"/>
            <HttpRef ref="TOS-N4"/>
            <KafkaRef ref="KAFKA"/>
        </ControlRequest>
    </TosControl>
</Config>
